{
  "schema_version": 1,
  "id": "cli.managed-rg.no-match",
  "description": "Managed ripgrep reports a successful exhaustive search with no matches.",
  "input": {
    "argv": ["--mode", "server", "--rg", "missing-needle", "."],
    "cwd_fixture": "empty-workspace",
    "env": { "NO_COLOR": "1" }
  },
  "expected": {
    "exit_code": 0,
    "stdout": "No matches.\n",
    "stderr": ""
  },
  "allowed_differences": ["managed-rg-is-local"]
}
